ProblemUID,ProblemTitle,Description,distribution,parameter(s),hint,comment
1,Broken Yardstick P1,A yard stick is broken randomly into 8 pieces.  X = the distance (in yards) from one end of the stick to the 3rd break point.,Beta,alpha = 3; beta = 6,break points are uniform over the stick,
2,Software Training P1,Four of the 15 administrative assistants in an office have been trained in a new software program. Five of the 15 assistants are randomly selected to take part in a focus group about office procedures. X = the number of those in the focus group who have had the software training.,Hypergeometric,N=15; M= 4; n=5,focus group sampled without replacement,
3,Toothpaste Use P1,A 6.25-ounce tube of Crest toothpaste is used regularly by all members of a household until the tube is finished and then it is replaced by another tube of the same brand. X = how much toothpaste (in ounces) is in the current tube at a randomly chosen time.,Continuous Uniform,A=0; B=6.25,toothpaste used up at a constant pace,
4,Correct Change P1,X = how many of the next 20 customers at a hot dog stand have the correct change to pay for their purchases.,Binomial,n = 20; p = probability that a random customer has the correct change,customers are essentially independent,Also approximately normal if p is not too small or too large
5,Lemon Law P1,"Ohio's lemon law allows people who buy a lemon (a vehicle that turns out to be excessively defective) to return it for a refund. However, in Ohio, only about 24 cars are expected to be declared ?lemons"" each year. X = the time until the next car is returned under Ohio's lemon law.",Exponential,r = 24 per year (mean = 1/r=1/24 year or 1/2 month),time to rare event,alternate answer is Gamma with parameters 1 and 1/24
6,Powerball Lottery P1,X = the first number drawn (from the numbers 1 to 59) for this week's Powerball lottery.,discrete uniform,a=1; b=59,equal chances on numbers,
7,Survey Responder P1,"A polling company gets respondents for a survey through random digit dialing.  However there is a large proportion of people, who are not available or refuse to answer the survey questions.  X=how many calls must be made before they get the first respondent.  ",Geometric,p = probability that a person is available and willing to be interviewed when called,calls until first success,
8,Survey Responder P2,"A polling company gets respondents for a survey through random digit dialing.  However there is a large proportion of people, who are not available or refuse to answer the survey questions. The company needs a sample of 100 respondents in order to fulfill a contract. X=how many calls are made before they fulfill their contract.",Negative Binomial,k = 100; p = probability that a person is available and willing to be interviewed when called,calls until 100th success,Also approximately normal if p is not too small
9,GW Bridge Traffic P1,"The George Washington Bridge connecting New Jersey and New York is the busiest bridge in the world, carrying about 100 million vehicles a year.  On average, there is approximately one fatal accident per 20 million vehicles.  X = the number of fatal accidents on the George Washington Bridge next year.",Poisson,lamda = 5,fatal accidents are rare and close to indpendent of each other,Poisson still reasonable even if the number of fatal accidents changes with the seasons of the year.
10,B-negative Blood Type P1,X = How many people must be tested until you find 3 that have a B negative blood type.  ,Negative Binomial,k = 3; p = probabilitity that a random person has B- blood (about 2%),tests until 3rd success,
11,Die Rolls P1,X = how many of each number you get when you roll a die 25 times,Multinomial,n = 25; p1=p2=p3=p4=p5=p6 = 1/6,counting multiple categories,
12,DNA Radiation Damage P1,A radiation source causes the strand of DNA along a chromosome to randomly break into two pieces (i.e. one break point). X = the proportion of the way from one end of the strand to the other that the break occurs.,Standard Uniform,none (or A=0; B=1 in general uniform),probability spread evenly,
13,Miami Homicide P2,The homicide rate in Miami Florida averages 1 per week throughout the year. X = the day when Miami will see it?s 10th homicide next year.,Gamma,k = 10; theta = 7,time to 10th rare event, a.k.a. Erlang distribution in this case
14,Extra Large Eggs P1,The USDA defines an ?Extra Large? egg as one weighing between 2.25 and 2.5 ounces.  Eggs are packaged by the dozen with 30 dozen to a case. X = the total weight (ounces) of the eggs in a random case delivered to a grocery.,Normal,mu = 855 ounces; sigma = 1.37 ounces,sum of large number of  independent comparable parts,Assume relatively uniform distribution of weights between 2.25 and 2.5 ounces per egg .  Otherwise can get bounds on mu and sigma that will be close to these values.
15,B-negative Blood Type P2,X = How many people must be tested until you find someone with a B negative blood type.  ,Geometric,p = probabilitity that a random person has B- blood (about 2%),tests until 1st success,
16,GW Bridge Traffic P2,"The George Washington Bridge connecting New Jersey and New York is the busiest bridge in the world, carrying about 100 million vehicles a year.  On average, there is approximately one fatal accident per 20 million vehicles.  X = the time (in years) until the next fatal accident on the George Washington Bridge.",Exponential,r = 5 per year (mean = 1/r = 1/5 year),time to rare event,Assumption of constant rate may not be appropriate (affects the mean - but exponential distribution still likely to be reasonable)
17,Penn Turnpike Call-boxes P1,Emergency call-boxes are systematically placed 1 mile apart along the Pennsylvania Turnpike where cell phone service is very spotty. Your car breaks down suddenly as you are driving east on the Pennsylvania Turnpike though luckily you had been keeping an eye out for the call boxes before your breakdown.  X= the distance you will need to walk to reach the closest call-box.,Continuous Uniform,A = 0; B = 0.5,no preference for any particular place to break down,
18,Penn Turnpike Call-boxes P2,Emergency call-boxes are systematically placed 1 mile apart along the Pennsylvania Turnpike where cell phone service is very spotty. Your car breaks down as you are driving east on the Pennsylvania Turnpike so you walk eastward until you reach a call-box.  X= the distance in miles you will need to walk to reach the next call-box.,Standard Uniform,none (or A=0; B=1 in general uniform),no preference for any particular place to break down,"alternate answer is Beta (1,1)"
19,B-negative Blood Type P3,X = How many people have a B negative blood type in a sample of just one randomly selected person.  ,Bernoulli,p = probabilitity that a random person has B- blood (about 2%),variable can only be zero or one,alternate answer is Binomial with n=1
20,2012 Presidential Race P1,There were 29 national polls published in the week before the 2012 U.S. Presidential race to gauge the voter support for President Barrack Obama and former Massachusetts Governor Mitt Romney.  Before the results of these polls were known: let X = the average percentage of the two-party vote amongst respondents that favor the President?s bid for re-election across the 29 polls.,Normal,mu = percentage of the two-party vote who favored the President's re-election for all voters;  sigma^2 = sum of variances for individual polls/841,each of the 29 individual polls had a large sample size,assumes the average bias across all polls is negligble
21,Broken Wikipedia Links P1,X = the number of broken links in a randomly selected  page in Wikipedia,Poisson,lamda = average number of broken links per page in all of Wikipedia,broken links are rare,
22,HS Pizza Delivery P1,20 high school students apply for a summer job delivering pizza and 12 of them own a car.  Five of the students are picked randomly and called in for an interview. X = how many of the interviewed students own a car.,Hypergeometric,N=20; M=12; n=5,interviewees sampled without replacement,
23,Account Auditing Case P1,A small auditing firm does random checks on accounts and assigns cases that show irregularities to an accountant for further study.  X = how many accounts are checked before all five of the firm's accountants have a case for review.,Negative Binomial,k = 5; p = probabilitity that a random account shows irregularites,checks until 5th success,
24,CPU Job Processing P1,"Ten % of the jobs run on a computer take up 90% of the processing time and 10% of those top 10% take up 90% of the time dedicated to those jobs, etc? X= the time taken by a randomly selected job.",Pareto,k = log(10)/log(9),compare with 80-20 rule,
25,Petrol Pump Purchases P1,X = the number of gallons of gas purchased by the next 100 customers at a service station,Normal,mu = 100*average amount purchased; sigma=10*st.dev of amounts purchased,sum of gas purchased by independent customers,
26,Cook premature infant weight P1,X= the number of premature infants weighing less than 4 pounds are born tomorrow at the Cook County Hospital maternity ward in Chicago,Poisson,mu = average number of premature infants per day,number of rare events in a fixed tme period,
27,Online hardware sales P1,"An online store only sells desktop computers, laptops, and tablets. X = how many of each type of machine will be in their next 100 sales",multinomial,n=100; p1=probability that the next machine sold is a desktop; p2=probability it's a laptop; p3=1-p1-p2,counting multiple categories,
28,Customer Service Calls P1,X = the differnce between the time to the next call to a customer service line and the time to the call after that.,Laplace,mu = 0; b = average time between calls,difference between X1= time to event governed by large independently acting population and independent X2 = time to same type of event,
29,Plane Crash intervals P1,X = the ratio of the time to the next major plane crash and the time between now and the one after that.,Standard Uniform,none (or A=0; B=1 in general uniform),time between plane crashes is nearly memoryless,
30,Highway Car Colors P1,X = how many of the next 20 cars that pass you on the highway are silver colored,Binomial,n=20; p= population proportion of passing cars that are silver,car colors are independent,
31,Highway Car Colors P2,X = how many cars pass you on the highway before one of them is silver colored,Geometric,p= population proportion of passing cars that are silver,each passing car is another trial,
32,Restaurant salt use P1,A popular restaurant is completely full every Friday night.  X = the ratio of the variance of the amount of salt the restaurant will use on Friday nights this month compared to next month.,F,df1 = number of Fridays this month minus 1; df2 = number of Fridays next month minus 1,What distribution models total salt use from Friday to Friday?,
33,Restaurant salt use P2,A popular restaurant is completely full every Friday night.  X = the amount of salt the restaurant will use next Friday night.,Normal,mu = average amount used on Friday nights; sigma = standard deviation of amounts from Friday-to-Friday,sum of amounts used by approximately constant number of nearly independent customers,
34,Customer Service Calls P2,X = the number of calls to a customer service line in the next hour.,Poisson,mu = call rate per hour,number of events governed by large independently acting population,
35,Horse Race P1,Three horses are randomly picked from the 12 competing in a race and you place a bet on each of these three horses to win the race.  X=the number of winning tickets purchased.,Bernoulli,p = 25% (3/12),only one winner possible,
36,Horse Race P2,"Three horses are randomly picked from the 12 competing in a race and you place a bet on each of these three horses to show (i.e. come in first, second, or third).  X=the number of winning tickets purchased.",Hypergeometric,N=12; M=3; n=3,chosen horses each hold separate position,randomly picked means srs here
37,Alarm Clock P1,When you wake up tomorrow morning you look at the digital clock next to your bed and watch it until the time changes. X = how long you have to wait in minutes,Standard Uniform,none (or A=0; B=1 in general uniform),no time within the minute you awaken is more likely than another,
38,Happiness Experiment P1,"40 subjects taking part in an experiment on the effect of exercise on happiness record how many times they laugh during the day before and the day after taking part in an active exercise program. Assuming the program has no effect on happiness, let X = the average difference between the recorded laughter values before and after the program.",Normal,mu =0; sigma^2 = variance of difference for individuals divided by 40,with no effect expect no difference,assume of independent individuals
39,Happiness Experiment P2,"80 subjects taking part in an experiment on the effect of exercise on happiness record how many times they laugh during the day before and the day after either taking part in an education program on the value of exercise (40 random subjects) or taking part in an active exercise program (40 random subjects). Assuming neither program has an effect on happiness, let X = the ratio of the average difference between the recorded before and after laughter values for those in the education program versus the average difference for those in the exercise program. ",Standard Cauchy,no parameters; or regular cauchy with parameters 0 and 1,CLT for numerator and denominator,note same variance for numerator and denominator
